{
  "schema_version": "2.0",
  "video_id": "measurement-boundaries",
  "episode_content_hash": "cbda952b7881d6cdbf23d53e3eaad18f521f408616fcc248bef77ad3706438ab",
  "assets": [
    {
      "asset_id": "ex-repeated-subexpression",
      "path": "docs/video_factory/deep_series/examples/ex-repeated-subexpression.json",
      "kind": "stable-example-contract",
      "source_or_license": "project-internal conceptual example bound to the episode bible",
      "width": null,
      "height": null,
      "sha256": "554c477b2d5fb0b61b865cc74a7fdb22c7065659b5b5a61ed5fe042ff9afa41d",
      "generator": "deep_series_authoring.py author"
    },
    {
      "asset_id": "measurement-boundaries-contact_sheet",
      "path": "docs/video_factory/deep_series/episodes/measurement-boundaries/previews/contact_sheet.png",
      "kind": "storyboard-contact-sheet",
      "source_or_license": "deterministic local rendering through POP cm_science; no external assets",
      "width": 1920,
      "height": 776,
      "sha256": "963a19fd2295eed1cc7cbd86e016406d034e24b235e5c52db76e1d893e3d5db8",
      "generator": "deep_series_authoring.py render-previews --pop-root <POP-Video-Creator>"
    },
    {
      "asset_id": "measurement-boundaries-animatic",
      "path": "docs/video_factory/deep_series/episodes/measurement-boundaries/previews/animatic.gif",
      "kind": "low-resolution-animatic",
      "source_or_license": "deterministic local rendering through POP cm_science; no external assets",
      "width": 640,
      "height": 360,
      "sha256": "6d4204945f7cff217c5cdfa15edebac4d83341bdbe5db719ab44c5685111e86a",
      "generator": "deep_series_authoring.py render-previews --pop-root <POP-Video-Creator>"
    }
  ],
  "content_hash": "e2c79bc92ed746225e7d2a10d5c23c3b440044d7e79fdb2a92a37a0abedfc10a"
}
