{
  "schema_version": "2.0",
  "video_id": "representation-decision",
  "episode_content_hash": "7f76b9abb51d49ee81009904a462ffdd29e5e037bd7a53a274fc4adcddd03bd1",
  "assets": [
    {
      "asset_id": "ex-feature-model",
      "path": "docs/video_factory/deep_series/examples/ex-feature-model.json",
      "kind": "stable-example-contract",
      "source_or_license": "project-internal conceptual example bound to the episode bible",
      "width": null,
      "height": null,
      "sha256": "1c752bfd2f34acbc989677c231e504b554e55810f0b6eef801b2c0a5b39733a4",
      "generator": "deep_series_authoring.py author"
    },
    {
      "asset_id": "representation-decision-contact_sheet",
      "path": "docs/video_factory/deep_series/episodes/representation-decision/previews/contact_sheet.png",
      "kind": "storyboard-contact-sheet",
      "source_or_license": "deterministic local rendering through POP cm_science; no external assets",
      "width": 1920,
      "height": 776,
      "sha256": "98dee2b0879a834bb9f399da44198362027d605f57ca0742eff1392ed8e93f5f",
      "generator": "deep_series_authoring.py render-previews --pop-root <POP-Video-Creator>"
    },
    {
      "asset_id": "representation-decision-animatic",
      "path": "docs/video_factory/deep_series/episodes/representation-decision/previews/animatic.gif",
      "kind": "low-resolution-animatic",
      "source_or_license": "deterministic local rendering through POP cm_science; no external assets",
      "width": 640,
      "height": 360,
      "sha256": "437c1c4fa612f490bccc1104543c69d9a59e9b812ab658536d3ce4fcd691b16d",
      "generator": "deep_series_authoring.py render-previews --pop-root <POP-Video-Creator>"
    }
  ],
  "content_hash": "c0bfa2f19892b4ae392b8b8fb6dd9523f25cd0a1565910d96403fabaa381e303"
}
