{
  "schema_version": "2.0",
  "video_id": "recognition-d8",
  "episode_content_hash": "4a46dd80264963627a4d8c6b4707bf82d1b224aec68236ea8991a68c83a4019f",
  "assets": [
    {
      "asset_id": "ex-policy-revisions",
      "path": "docs/video_factory/deep_series/examples/ex-policy-revisions.json",
      "kind": "stable-example-contract",
      "source_or_license": "project-internal conceptual example bound to the episode bible",
      "width": null,
      "height": null,
      "sha256": "7b59f48caadcd7bbaf30471228b01c2f2bba50401f60fd5395122acfeb718621",
      "generator": "deep_series_authoring.py author"
    },
    {
      "asset_id": "recognition-d8-contact_sheet",
      "path": "docs/video_factory/deep_series/episodes/recognition-d8/previews/contact_sheet.png",
      "kind": "storyboard-contact-sheet",
      "source_or_license": "deterministic local rendering through POP cm_science; no external assets",
      "width": 1920,
      "height": 776,
      "sha256": "8893de386082e888b2c2653c71de48c8f83098140699ca356d0f9eb48f7307b7",
      "generator": "deep_series_authoring.py render-previews --pop-root <POP-Video-Creator>"
    },
    {
      "asset_id": "recognition-d8-animatic",
      "path": "docs/video_factory/deep_series/episodes/recognition-d8/previews/animatic.gif",
      "kind": "low-resolution-animatic",
      "source_or_license": "deterministic local rendering through POP cm_science; no external assets",
      "width": 640,
      "height": 360,
      "sha256": "0b714d2c9b47cfbec9142a6feab2e37f7a1fadd6af309d65343fecda821c5165",
      "generator": "deep_series_authoring.py render-previews --pop-root <POP-Video-Creator>"
    }
  ],
  "content_hash": "db2ceee8635a9263ee1e4a2a83f8329ee50a33ac1429d5ec9fabcfc4dd0dd111"
}
